"date_of_notice","card_date","month_year","date_of_notice_additional_info","event_number","rapid_response_specialist","reason_stated_for_filing","company","address","location","county","wdb_name","region","contact","phone","business_type","number_affected","raw_number_affected","rescission_amend","total_employees","raw_total_employees","not_affected","layoff_date","closing_date","reason_for_dislocation","fein_num","union","classification_and_additional_info"
"2022-08-22","August 22, 2022","August 2022",NA,"2022-0012","Frederick Danks","Plant Closing","Packable Holdings, LLC (Pharmapacks, LLC)","Multiple Long Island locations","Nassau, Suffolk |Wdb Name: Hempstead, Suffolk | Region: Long Island","Nassau, Suffolk","Hempstead, Suffolk","Long Island","Leanna Bautista, Chief People Officer","(929) 201-1753","Multi-marketplace e-commerce enablement platform","456 (total affected employees at all sites)",456,456,"456",456,0,"Separations for 23 employees in Hauppauge occurred on 8/22/2022 and remaining separations will continue in waves up until 12/18/2022. Separations for 2 employees in Edgewood occurred on 8/22/2022 and remaining separations will continue in waves up until 1/8/2023. Separations for 66 employees in New Hyde Park occurred on 8/22/2022 and remaining separations will continue in waves up until 1/8/2023.","1/8/2023","Economic - as a result of the Company’s inability to secure financing to continue the Company’s business.","27-0896676","The employees are not represented by a union.","Plant Closing Packable Holdings, LLC (Pharmapacks, LLC) Long Island sites: 1516 Motor Parkway, Hauppauge, New York 11749 (202 affected employees) 80 Wilshire Blvd, Edgewood, NY 11717 (155 affected employees) 1985 Marcus Ave, New Hyde Park, NY 11042 (99 affected employees)"
"2022-08-11","August 11, 2022","August 2022",NA,"2022-0011","Elias Flores","Plant Layoff/Possible Plant Closing","Ultra Seal Corporation","","Ulster |Wdb Name: Ulster | Region: Mid-Hudson Region","Ulster","Ulster","Mid-Hudson Region","Terry Murphy, Controller","(845) 255-2490 Ext: 109","Medical equipment manufacturer","86",86,86,"86",86,0,"It is expected that permanent layoffs could begin within 90 days (from August 11, 2022 notice date) affecting up to 86 employees.","The business has not yet determined if the sites will be closing.","As a result of findings of an evaluation (FDA mandated) of the company’s compliance with Current Good Manufacturing Practices, a mass layoff is expected to occur at the business impacting three (3) sites.","13-2888109","The employees are not represented by a union.","Plant Layoff/Possible Plant Closing Ultra Seal Corporation sites: 521 Main Street, New Paltz, NY 12561 (71 employees affected) 311 Vineyard Avenue, Highland NY 12528 (14 employees affected) 5 Orchard Drive, Gardiner, NY 12561 (1 employee affected)"
"2022-04-21","April 21, 2022","April 2022","And 5/24/2022","2022-0010","Stuart Goldberg","Plant Layoff","Cable News Network, Inc., CNN America, Inc., WarnerMedia, LLC., Discovery Communications,","","New York |Wdb Name: New York City | Region: New York City","New York","New York City","New York City","Faye Barbour, VP & Associate General Counsel","(404) 827-3651","Television network","239",239,239,"239",239,0,"This reduction will result in 239 employee separations beginning on July 20, 2022, or the 14-day period starting on that date and on August 27, 2022, or the 14-day period starting on that date.","-----","As a result of organizational changes, the companies have decided to shut down CNN+, eliminating all CNN+ positions and reduce the levels of current employees who are a part of the companies’ operations.","58-2632304","The employees are not represented by a union.","Plant Layoff"
"2022-08-09","August 9, 2022","August 2022",NA,"2022-0009","Elias Flores","Plant Closing","Garnet Health Doctors","","Orange, Sullivan |Wdb Name: Orange, Sullivan | Region: Mid-Hudson Region","Orange, Sullivan","Orange, Sullivan","Mid-Hudson Region","Lauren Carberry, Administrator, Employee & Labor Relations","845-333-7157","Medical center","29 (employees at all sites)",29,29,"29",29,0,"The following Garnet Health Doctors sites will be closing effective November 9, 2022 affecting a total of 29 employees among all sites.","11/9/2022","Economic","37-1743537","1199 SEIU United HealthCare Workers East","Plant Closing Garnet Health Doctors sites: ORMG OBGYN, 707 East Main Street, Middletown, NY 10940 (17 employees affected) Goshen Rheumatology, 102 Clowes Ave, Goshen, NY 10924 (6 employees affected) ORMG Pediatrics, 707 East Main Street, Middletown, NY 10940 (2 employees affected) CRMC Primary Care Montreign, 38 Concord Road, Monticello, NY 12701 (3 employees affected) CRMCG Physicians OB GYN, 68 Harris Bushville Road, Harris, NY 12742 (1 employee affected)"
"2022-03-31","March 31, 2022","March 2022","Rescission: 8/1/2022","2021-0062","Stuart Goldberg","Plant Closing","Research Foundation of The City University of New York - Resource Navigator Corps (at the","CUNY Graduate School of Public Health & Health Policy)","New York |Wdb Name: New York City | Region: New York City","New York","New York City","New York City","Crawford Grell, Associate Director of Human Resource","(917) 843-8321","National health foundation in New York City","75",75,0,"75",75,0,"The business is rescinding their WARN notice dated March 31, 2022. Funding for the Resource Navigator Corps. Project has been renewed from July 1, 2022 through June 30, 2023 affecting 75 employees.","June 30, 2022","Loss of funding","13-1988190","The employees are not represented by a union.","Plant Closing"
"2022-08-01","August 1, 2022","August 2022",NA,"2022-0008","Stuart Goldberg","Plant Closing","Gimme Dat Money, LLC (Desus & Mero Show)","481 8th Ave","New York |Wdb Name: New York City | Region: New York City","New York","New York City","New York City","Rebecca Drootin, Line Producer","(201)-747-4738","TV show","73",73,73,"73",73,0,"There will be permanent layoffs of 73 employees beginning on August 15, 2022. Some employees will be retained with the wrap up of the show and their employment will end on November 18, 2022.","11/18/2022","TV hosts Desus Nice and The Kid Mero are in pursuit of separate creative endeavors.","83-2157507",NA,"Plant Closing"
"2022-07-29","July 29, 2022","July 2022",NA,"2022-0007","Frederick Danks","Plant Closing","RoundPoint Mortgage Servicing Corporation","175 Pinelawn Road, Suite 400","Suffolk |Wdb Name: Suffolk | Region: Long Island","Suffolk","Suffolk","Long Island","Zenobia Littlejohn, VP, Human Resources","(856) 380-9628","Non-bank mortgage lending and servicing company","71",71,0,"71",71,0,"The business will be permanently closing affecting 71 employees. Separations will begin on October 27, 2022 or the 14-day period commencing on that date.","10/27/2022","Economic","26-1193089","The employees are not represented by a union.","Plant Closing"
"2022-07-29","July 29, 2022","July 2022",NA,"2022-0006","Stuart Goldberg","Plant Layoff","Signify Health, LLC (Episodes of Care Services Operations)","685 3rd Avenue, 2nd Floor","New York |Wdb Name: New York City | Region: New York City","New York","New York City","New York City","Brad Crain, Director, Employee Experience","(469) 466-7024","Home-based care management services","92",92,92,"175",175,83,"Separations will begin on 10/1/2022.","----","Discontinuation of its Episodes of Care Services Operation","82-3563982","The employees are not represented by a union.","Plant Layoff"
"2022-07-15","July 15, 2022","July 2022",NA,"2022-0004","Stuart Goldberg","Plant Closing","PMI Global Services Inc. & Philip Morris Global Brands Inc. (collectively PMI)","120 Park Avenue","New York |Wdb Name: New York City | Region: New York City","New York","New York City","New York City","Christopher Severson, Head of People and Culture, U.S.","(347) 891-0366","Tobacco company","99",99,99,"99",99,0,"The business will be permanently relocating certain operations to a new location in Stamford, Connecticut (approximately 37 miles away) effective on or about 10/31/2022 affecting 99 employees. A total of 13 employees will be permanently separated between 5/31/2022 and 2/28/2023, and the remaining 86 employees will be offered continued employment in the new Connecticut office. Those employees who elected not to work in Stamford will be separated between 5/31/2022 and 7/28/2023.","10/31/2022","Relocation to Stamford, Connecticut","03-0494952","The employees are not represented by a union.","Plant Closing"
"2022-07-14","July 14, 2022","July 2022",NA,"2022-0005","John Hetfield","Plant Closing","Prevost Car (US) Inc.","260 Banker Road","Clinton |Wdb Name: C-E-F-H | Region: North Country Region","Clinton","C-E-F-H","North Country Region","Robert Wells, HR Business Partner","(817) 291-4793:","Manufacturer specialized in touring coaches and bus shells for high-end motorhomes and specialty conversions.","53",53,53,"53",53,0,"The business will be ending production for The Buy America Act market/customer. Permanent separations affecting 53 employees will occur between October 15, 2022 and February 28, 2023.","2/28/2023","A business plan change and reorganization","14-1768147","The employees are not represented by a union.","Plant Closing"
"2022-07-15","July 15, 2022","July 2022",NA,"2022-0003","Stuart Goldberg","Plant Closing","Central Park Boat House, LLC","Park Drive North, E 72nd St","New York |Wdb Name: New York City | Region: New York City","New York","New York City","New York City","Dean J. Poll, President","(212) 586-5000","American restaurant","163",163,163,"163",163,0,"Due to rising labor and costs of goods, the business will be permanently closing effective 10/16/2022 affecting a total of 163 employees.","10/16/2022","Economic","06-1585011","New York Hotel and Motel Trades Council, AFL-CIO","Plant Closing"
"2022-07-12","July 12, 2022","July 2022",NA,"2022-0002","Stuart Goldberg","Plant Layoff","Freshly, Inc.","115 E. 23rd Street, Floor 7","New York |Wdb Name: New York City | Region: New York City","New York","New York City","New York City","Kelsey Comstock, Director of Public Relations","(617) 721-6531","Prepared meal delivery company","48",48,48,"190",190,142,"The business will be permanently separating 48 employees assigned to the 115 E. 23rd Street site effective October 10, 2022.","----","Restructuring the organization","46-3173351","The employees are not represented by a union.","Plant Layoff"
"2022-07-06","July 6, 2022","July 2022",NA,"2022-0001","Stuart Goldberg","Plant Closing","The Stewart Hotel","371 7th Avenue","New York |Wdb Name: New York City | Region: New York City","New York","New York City","New York City","Xerxes Cursetji, General Manager","(646) 733-2905","Hotel","158",158,158,"158",158,0,"10/7/2022","10/7/2022","Will be converted to residential housing","81-4319270","New York Hotel & Motel Trades Council, AFL-CIO affiliated with UNITE HERE","Plant Closing"
"2022-06-30","June 30, 2022","June 2022",NA,"2021-0089","John Hetfield","Temporary Plant Layoff","AQ Wiring Systems NY, Inc.","18 Northern Ave., Suite 100","Clinton |Wdb Name: C-E-F-H | Region: North Country Region","Clinton","C-E-F-H","North Country Region","Kristen Siskavich, HR Manager","(518) 324-4800 Ext: 103","Manufacturer specialized in the fabrication and assembly of low voltage electrical wire harnesses.","58",58,58,"77",77,19,"7/7/2022","----","As a result of the economic impact of the Nova Bus strike in Canada, the business will be temporarily separating 58 employees on July 7, 2022. At this time, the length of this period of disruption is unknown.","98-0058750","The employees are not represented by a union.","Temporary Plant Layoff"
"2022-06-21","June 21, 2022","June 2022",NA,"2021-0088","Michael Clark","Plant Closing","Sodexo, Inc. (at SUNY Polytechnic Institute)","100 Seymour Rd,","Oneida |Wdb Name: Hmo | Region: Mohawk Valley Region","Oneida","Hmo","Mohawk Valley Region","Curtis Stancil, HR Business Partner Director University Segment Northeast Region","(860) 546-6547","Dining services","63",63,63,"63",63,0,"The business will be permanently closing effective June 30, 2022. Separations for frontline employees will occur on or about June 30, 2022 and on July 28, 2022 for Management.","6/30/2022","This closing is due to the termination by SUNY Polytechnic Institute of Sodexo’s contract to perform dining services.","52-2282038","Civil Service Employees Association","Plant Closing"
"2022-06-28","June 28, 2022","June 2022",NA,"2021-0087","Amy Riter","Plant Closing","PharMerica Corporation (Pharmacy)","2355 Union Road, Suite 200","Erie |Wdb Name: Erie | Region: Western Region","Erie","Erie","Western Region","Melissa Phagooram, HR Generalist","(516) 536-0800 Ext: 887693","Pharmacy","36",36,36,"36",36,0,"The business will be permanently closing their pharmacy affecting 36 employees. Separations will begin on 9/30/2022, or the 14-day period starting on that date.","9/30/2022","Economic","95-3849613","The employees are not represented by a union.","Plant Closing"
"2022-06-24","June 24, 2022","June 2022",NA,"2021-0086","Frederick Danks","Plant Closing","VSP Optical Group, Inc. (VSPOne)","35 Hub Drive, Suite 100","Suffolk |Wdb Name: Suffolk | Region: Long Island","Suffolk","Suffolk","Long Island","Lauren White, HR Manager","(916) 851-4488","Unified network of optical laboratories","20",20,20,"20",20,0,"Separations affecting 20 employees will occur on 9/29/2022 (19) and on 11/1/2022 (1).","7/29/2022","To increase the efficiency of the company's manufacturing business","27-0621143","The employees are not represented by a union.","Plant Closing"
"2022-05-18","May 18, 2022","May 2022","Rescission: 6/20/2022","2021-0078","Stuart Goldberg","Plant Closing","Preferred Meal Systems, Inc./The Maramont Corporation","","Kings |Wdb Name: New York City | Region: New York City","Kings","New York City","New York City","Pamela Souza, Vice President of Human Resources","(980) 585-0629","Provide healthy quality packed foods","47",47,0,"331",331,284,"The business is rescinding the prior WARN notice issued on May 18, 2022 impacting the 284 employees working at the 5600 1st Avenue, Brooklyn, NY 11220 site. Note: The business has entered into an agreement to sell the assets of the Brooklyn site to Whitsons Culinary Group, whereby Whitsons will continue operations and have extended offers of continued employment to the majority of the individuals employed at the site.","8/16/2022","Economic","36-2664596","Laundry,Distribution and Food Service Joint Board, Workers United, an SEIU affiliate United Production Workers Union, Local 17-18 York-New Jersey Regional Joint Board, Workers United, an SEIU Affiliate, Local 132","Plant Closing Preferred Meal Systems, Inc./The Maramont Corporation sites: 5600 1st Ave, Brooklyn, NY, 11220 (284 employees affected) 2016 Pitkin Avenue, Brooklyn, NY 11207 (47 employees affected)"
"2022-06-15","June 15, 2022","June 2022",NA,"2021-0085","Amy Riter","Plant Closing","Far-Go Logistics LLC","800 Riverwalk Parkway","Erie |Wdb Name: Erie | Region: Western Region","Erie","Erie","Western Region","Carla Hernandez, Co-Owner/Operations Manager","(716) 335-3431","Insured logistics outsource solution for companies","72",72,72,"72",72,0,"The business will be permanently closing effective September 15, 2022 affecting 72 employees. All separations are expected to occur on September 15, 2022.","9/15/2022","Results of a company transfer","85-3433753","The employees are not represented by a union.","Plant Closing"
"2022-06-07","June 7, 2022","June 2022",NA,"2021-0084","Stuart Goldberg","Plant Layoff","Berenberg Capital Markets, LLC","1251 Ave. of the Americas","New York |Wdb Name: New York City | Region: New York City","New York","New York City","New York City","Theresa Rinaldi-Reisch, Senior HR Manager","(646) 949-9000","Financial planner","47",47,47,"----",NA,NA,"The business will be permanently separating a total of 47 employees effective September 6, 2022.","----","Economic","13-3867443","The employees are not represented by a union.","Plant Layoff"
"2022-06-01","June 1, 2022","June 2022",NA,"2021-0083","Regenna Darrah","Plant Closing","Coram, CVS Specialty Infusion Services","12 Jupiter Lane","Albany |Wdb Name: Capital District | Region: Capital Region","Albany","Capital District","Capital Region","Christina Gawrysh, Director, HR Business Partner","(224) 301-0376","Medical clinic","70",70,70,"70",70,0,"The business will be permanently closing its Albany facility affecting a total of 70 employees. Separations will occur during the 14-day period starting on September 4, 2022.","9/18/2022","Economic","58-1813486, 84-1300129","The employees are not represented by a union.","Plant Closing"
"2022-06-01","June 1, 2022","June 2022",NA,"2021-0082","Stuart Goldberg","Plant Closing","Coram, CVS Specialty Infusion Services","48-23 55th Avenue","Queens |Wdb Name: New York City | Region: New York City","Queens","New York City","New York City","Christina Gawrysh, Director, HR Business Partner","(224) 301-0376","Medical clinic","138",138,138,"138",138,0,"The business will be permanently closing its Maspeth facility affecting a total of 138 employees. Separations will occur during the 14-day period starting on September 4, 2022.","9/18/2022","Economic","58-1813486, 84-1300129","The employees are not represented by a union.","Plant Closing"
"2022-01-25","January 25, 2022","January 2022","Rescission: 6/2/2022","2021-0042","Elias Flores","Plant Closing","City Carting of Westchester, Inc.","","Westchester |Wdb Name: Westch/Ptnm | Region: Mid-Hudson Region","Westchester","Westch/Ptnm","Mid-Hudson Region","Robert G. Oxer, Company President","(914) 423-0420","Waste Management","79",79,0,"79",79,0,"The business has been further authorized by Westchester County Solid Waste Commission to engage in the waste management business through March 1, 2023. Therefore, most recent layoffs anticipated to occur May 25, 2022 have been rescinded.","End of business day on 4/25/2022.","The layoffs will be the result of a Stipulation of Settlement that resolves a proceeding commenced by the Westchester County Solid Waste Commission (SWC).","72-1564206","Private Sanitation Union Local 813","Plant Closing City Carting of Westchester, Inc. sites: 1 A, Stew Leonard Dr, Yonkers, NY 10710 (71 employees) 167 ROA Hook Rd., Cortlandt Manor, NY 10567 (2 employees) 41 Brockway Place, White Plains, NY, 10601 (3 employees) 10 Kimball Place, Mt. Vernon, NY, 10550 (3 employees)"
"2022-06-02","June 2, 2022","June 2022",NA,"2021-0081","Jason Kirchoff","Plant Closing","Silgan Containers Manufacturing Corporation","8673 Lyons Marengo Rd.","Wayne |Wdb Name: Finger Lakes | Region: Finger Lakes Region","Wayne","Finger Lakes","Finger Lakes Region","Brian Pulford, Manager, Employee & Labor Relations","(262) 569-2129","A solutions-based manufacturer of metal food containers","65",65,65,"65",65,0,"The business will be permanently closing affecting a total of 65 employees effective September 2, 2022.","9/2/2022","Due to Loss of customer base","06-1502009","UFCW Local One","Plant Closing"
"2022-06-01","June 1, 2022","June 2022",NA,"2021-0080","Paula Yerdon","Plant Layoff","Deli-Boy Inc.","100 Matthews Ave.","Onondaga |Wdb Name: Onondaga | Region: Central Region","Onondaga","Onondaga","Central Region","Brian A. Zilo, SVP of Human Resources","(586) 563-2888","Food distribution","35",35,35,"52",52,17,"There will be a permanent mass layoff at the business affecting a total of 35 employees. All separations are expected to occur on August 29, 2022.","----","This decision is based on offering our customers the widest selection of products in the fastest possible time, without compromising service levels and being as efficient as possible.","45-2850624","The employees are not represented by a union.","Plant Layoff"
"2022-05-25","May 25, 2022","May 2022",NA,"2021-0079","Stuart Goldberg","Plant Closing","The Research Foundation for the State University of New York at","Downtown Health Sciences University - ICLC","Kings |Wdb Name: New York City | Region: New York City","Kings","New York City","New York City","Gary Leipzig, Associate Director, HR","(718) 270-1182","Infant Child Learning Center","26",26,26,"26",26,0,"The Research Foundation for the State University of New York at Downtown Health Sciences University will be closing the Infant Child Learning Center (ICLC) effective 8/31/2022. Separations affecting 26 employees at the ICLC will occur on 8/31/2022 and may be extended up to 30 days for a few employees.","8/31/2022","Economic","14-1368361","United Federation of Teachers","Plant Closing"
"2022-05-18","May 18, 2022","May 2022",NA,"2021-0078","Stuart Goldberg","Plant Closing","Preferred Meal Systems, Inc./The Maramont Corporation","","Kings |Wdb Name: New York City | Region: New York City","Kings","New York City","New York City","Pamela Souza, Vice President of Human Resources","(980) 585-0629","Provide healthy quality packed foods","331 (total employees at both sites)",331,0,"331",331,0,"The separations of the affected employees will take place on August 16, 2022, or within 14 days thereafter.","8/16/2022","Economic","36-2664596","Laundry,Distribution and Food Service Joint Board, Workers United, an SEIU affiliate United Production Workers Union, Local 17-18 York-New Jersey Regional Joint Board, Workers United, an SEIU Affiliate, Local 132","Plant Closing Preferred Meal Systems, Inc./The Maramont Corporation sites: 5600 1st Ave, Brooklyn, NY, 11220 (284 employees affected) 2016 Pitkin Avenue, Brooklyn, NY 11207 (47 employees affected)"
"2022-05-16","May 16, 2022","May 2022",NA,"2021-0077","Paula Yerdon","Plant Closing","Advance Local Media, LLC","101 North Salina Street","Onondaga |Wdb Name: Onondaga | Region: Central Region","Onondaga","Onondaga","Central Region","Eric Adler, VP and General Counsel","(212) 286-8202","Digital Media & Marketing Agency","41",41,41,"41",41,0,". Separations affecting a total of 41 employees will begin on 8/14/2022 and be completed by 10/8/2022.","8/14/2022 (few employees will be remaining until 10/8/2022)","Economic","82-1985384","The employees are not represented by a union.","Plant Closing"
"2022-05-11","May 11, 2022","May 2022",NA,"2021-0076","Stuart Goldberg","Temporary Plant Closing","RHS Wine, LLC (at WSNYC, WS New York Tavern & WS Lifestyle Club)","","New York |Wdb Name: New York City | Region: New York City","New York","New York City","New York City","Laurie Smith, Chief Financial Officer","(212) 695-0351","Liquor business / industry within the Wholesale Trade","66",66,66,"66",66,0,"The business will be temporarily closing its operations on or about August 9, 2022 for renovation purposes and will affect 66 employees. Note: In connection with the temporary closing, the company will also be transferring management of the business operations to Major Management TCZ LLC, (MFG). Employees are welcome to apply through MFG to continue to work for the business upon reopening 4th quarter of 2022 or 1st quarter of 2023.","8/9/2022","Transferring management of the busiiness operations to Major Management TCZ LLC, (MFG).","36-4874699","The employees are not represented by a union.","Temporary Plant Closing RHS Wine, LLC (at WSNYC, WS New York Tavern & WS Lifestyle Club) sites: 37 Hudson Yards, New York, NY 10001 (63 employees) 55 Hudson Yards, Ste 22C, New York, NY 10001 (3 employees)"
"2022-05-06","May 6, 2022","May 2022",NA,"2021-0075","Frederick Danks","Plant Closing","Ben Elias Industries, Corp. and Kenco Retail Inc.","","Nassau |Wdb Name: Hempstead | Region: Long Island","Nassau","Hempstead","Long Island","Danielle Elias, In House Counsel","(646) 450-5291","Distributors of ladies' men's, & children's sportswear","79 (total employees at both sites)",79,79,"79",79,0,"The business will be closing on or before 8/4/2022 affecting a total of 79 employees who will be separated between 8/4/2022 and 8/18/2022.","Closing on or before 8/4/2022","Economic","13-1967197","Local 888 UFCW, AFL-CIO","Plant Closing Ben Elias Industries, Corp. and Kenco Retail Inc. sites: 223 West Merrick Road, Valley Stream, New York 11580 (8 employees) 100 Inip Drive, Inwood, NY 11096 (71 employees)"
"2022-05-06","May 6, 2022","May 2022",NA,"2021-0074","Stuart Goldberg","Plant Closing","Ben Elias Industries, Corp. and Kenco Retail Inc.","","Queens, New York |Wdb Name: New York City | Region: New York City","Queens, New York","New York City","New York City","Danielle Elias, In House Counsel","(646) 450-5291","Distributors of ladies' men's, & children's sportswear","38 (total employees at all NYC sites)",38,38,"38",38,0,"The business will be closing on or before 8/4/2022 affecting a total of 38 employees who will be separated between 8/4/2022 and 8/18/2022.","Closing on or before 8/4/2022","Economic","13-1967197","Local 888 UFCW, AFL-CIO","Plant Closing Ben Elias Industries, Corp. and Kenco Retail Inc sites: 550 7th Avenue, 12th Floor, New York, New York 10018 (12 employees) 74-25 Grand Avenue, Maspeth, New York 11373 (8 employees) 78-14 Roosevelt Avenue, Jackson Heights, New York 11368 (9 employees) 25-15 Broadway, Long Island City, New York 11106 (9 employees)"
