"date_of_notice","card_date","month_year","date_of_notice_additional_info","event_number","rapid_response_specialist","reason_stated_for_filing","company","address","location","county","wdb_name","region","contact","phone","business_type","number_affected","raw_number_affected","rescission_amend","total_employees","raw_total_employees","not_affected","layoff_date","closing_date","reason_for_dislocation","fein_num","union","classification_and_additional_info"
"2022-10-28","October 28, 2022","October 2022",NA,"2022-0047","Stuart Goldberg","Plant Closing","IKEA US RETAIL LLC","96-05 Queens Boulevard","Queens |Wdb Name: New York City | Region: New York City","Queens","New York City","New York City","Philip Wellington, IKEA Country People & Culture Manager","(610) 831-0180","Furniture and home accessories store","78",78,78,"78",78,0,"Separations for 78 employees will occur on February 1, 2023 or within a 14-day period thereafter.","February 1, 2023","Economic","23-3005575","The employees are not represented by a union.","Plant Closing"
"2022-10-31","October 31, 2022","October 2022",NA,"2022-0045","Elias Flores","Plant Closing","Indian Point Energy Center (IPEC) subsidiary of Holtec International; Holtec Decommissioning International, LLC","450 Broadway","Westchester |Wdb Name: Westch/Ptnm | Region: Mid-Hudson Region","Westchester","Westch/Ptnm","Mid-Hudson Region","Brenda Gailes, Director Human Resources","(508) 930-6870","Nuclear Power Plant","30",30,30,"30",30,0,"Separations for 30 employees will occur on or around February 15, 2023. This location is shut down and progressing through decommissioning.","February 15, 2023","Economic","13-4120330","Utility Workers Union of America - UWUA Local No. 1-2 and UWUA National","Plant Closing"
"2022-10-28","October 28, 2022","October 2022",NA,"2022-0044","Elias Flores","Plant Layoff","Strides Pharma, Inc.","Chestnut Ridge Plant","Rockland |Wdb Name: Rockland | Region: Mid-Hudson Region","Rockland","Rockland","Mid-Hudson Region","Scot Reid, Senior Director, Human Resources","(845) 682-3278","Manufacuring Medical Capsules","88",88,88,"----",NA,NA,"Separations for 88 employees will occur on or about January 27, 2023.","----","Business Restructuring","46-2953153","The employees are not represented by a union.","Plant Layoff"
"2022-10-24","October 24, 2022","October 2022",NA,"2022-0046","Regenna Darrah","Plant Closing","Exceeding Expectations, Inc. d/b/a Longfellows","500 Union Avenue","Saratoga |Wdb Name: Sar/War/Was | Region: Capital Region","Saratoga","Sar/War/Was","Capital Region","Gerri Thompson, Company Liaison","(518) 587-0108","Restaurant","80",80,80,"80",80,0,"Separations for 80 employees will occur on January 22, 2023.","January 22, 2023","Economic","14-1789602","The employees are not represented by a union.","Plant Closing"
"2022-10-11","October 11, 2022","October 2022",NA,"2022-0039","Frederick Danks","Plant Closing","Radienz Living, LLC","","Suffolk |Wdb Name: Suffolk | Region: Long Island","Suffolk","Suffolk","Long Island","Kathy Russell, Chief Human Resources Officer","(631) 952-0100 Ext: 3107","Disinfectant wipes and floor wipes business","145",145,145,"145",145,0,"The first separation of more than one employee will occur on January 15, 2023 and the other separations are expected to occur between January 31, 2023 through July 31, 2023.",NA,"Economic","11-3187548","The employees are not represented by a union.","Plant Closing Radienz Living, LLC sites: 105 Emjay Blvd, Brentwood, New York 11717 (88 employees affected) 445 Broad Hollow Rd., Melville, NY 11747 (44 employees affected) 110 Emjay Blvd, Brentwood, NY 11717 (13 employees affected)"
"2022-10-20","October 20, 2022","October 2022",NA,"2022-0043","Stuart Goldberg","Plant Layoff","Starry, Inc.","180 Maiden Lane, #1003","New York |Wdb Name: New York City | Region: New York City","New York","New York City","New York City","Jeremy MacKechnie, Head of People","(908) 447-0694","Internet Provider","49",49,49,"----",NA,NA,"Separations for 49 employees will occur on or around October 21, 2022.","----","Changes in business operational needs as result of finacial difficulties.","----","The employees are not represented by a union.","Plant Layoff"
"2022-10-06","October 6, 2022","October 2022",NA,"2022-0037","Susan Gallagher","Plant Layoff","Corning Pharmaceutical Technologies","271 County Road 64","Chemung |Wdb Name: Css | Region: Southern Region","Chemung","Css","Southern Region","Scott M. Kiefer, Division Manufacturing Director","(828) 838-9933","Pharmaceutical packaging","51",51,51,"----",NA,NA,"The expected date of the first separation of 51 employees is January 11, 2023, which includes the anticipated separation of six (6) salaried employees on January 11, 2023. Separation of two (2) salaried employees on January 14, 2023, and layoff of 43 union employees on January 16, 2023.","----","Revised the business operating plan to better align with company’s operating supply and customer demand.","16-0393470","United Steelworkers, Local 1000","Plant Layoff"
"2022-10-14","October 14, 2022","October 2022",NA,"2022-0042","Stuart Goldberg","Plant Layoff","Johnson and Johnson Services, Inc.","601 West 26th St.","New York |Wdb Name: New York City | Region: New York City","New York","New York City","New York City","LaToya Davis, Head of HR, Global Corporate Affairs","(609) 495-6023","Pharmaceutical Supplies","64",64,64,"----",NA,NA,"Sixty-four (64) employees will be separated during the following 14-day window from January 13, 2023 through January 26, 2023.","January 26, 2023","Economic","22-2203696","The employees are not represented by a union.","Plant Layoff"
"2022-10-13","October 13, 2022","October 2022",NA,"2022-0041","Elias Flores","Plant Closing","ABB/Con-Cise Optical Group LLC","4 Skyline Dr","Westchester |Wdb Name: Westch/Ptnm | Region: Mid-Hudson Region","Westchester","Westch/Ptnm","Mid-Hudson Region","Eddie Rodriguez, Human Resources Manager","(888) 305-3300 Ext: 1151","Contact lens distribution","107",107,107,"107",107,0,"Separations for 107 employees will begin on January 13, 2023.","1/13/2023","Consolidate distribution facility and expand Lab facility","51-0626564","The employees are not represented by a union.","Plant Closing"
"2022-10-11","October 11, 2022","October 2022",NA,"2022-0040","Stuart Goldberg","Plant Closing","Take-Two Interactive Software, Inc.","Playdots","New York |Wdb Name: New York City | Region: New York City","New York","New York City","New York City","Tamara Miller, Sr. Manager, People & Development","(347) 839-1691","Video game holding company","65",65,65,"65",65,0,"Separations for 65 employees will begin on January 9, 2023 and are expected to continue until approximately March 31, 2023.","3/31/2023","Economic","----","The employees are not represented by a union.","Plant Closing"
"2022-10-11","October 11, 2022","October 2022",NA,"2022-0039","Frederick Danks","Plant Closing","Radienz Living, LLC","","Suffolk |Wdb Name: Suffolk | Region: Long Island","Suffolk","Suffolk","Long Island","Kathy Russell, Chief Human Resources Officer","(631) 952-0100 Ext: 3107","Disinfectant wipes and floor wipes business","145",145,145,"145",145,0,"The first separation of more than one employee will occur on January 15, 2023 and the other separations are expected to occur between January 31, 2023 through July 31, 2023.",NA,"Economic","----","The employees are not represented by a union.","Plant Closing Radienz Living, LLC sites: 105 Emjay Blvd, Brentwood, New York 11717 (88 employees affected) 445 Broad Hollow Rd., Melville, NY 11747 (44 employees affected) 110 Emjay Blvd, Brentwood, NY 11717 (13 employees affected)"
"2022-10-11","October 11, 2022","October 2022",NA,"2022-0038","Stuart Goldberg","Plant Closing","HHC 33 Peck Slip Holdings, LLC d/b/a Mr. C Seaport Hotel","33 Peck Slip","New York |Wdb Name: New York City | Region: New York City","New York","New York City","New York City","Edoardo Minoli, General Manager","(347) 574-5388","Hotel","80",80,80,"80",80,0,"Separations for 80 employees will occur beginning on January 9, 2023, or the 14- day period commencing on that date.","January 9, 2023","Selling Mr. C Seaport Hotel to Sono Hospitality, LLC","----","Local 966, International Brotherhood of Teamsters","Plant Closing"
"2022-10-06","October 6, 2022","October 2022",NA,"2022-0036","Stuart Goldberg","Plant Closing","Patina BBG, LLC at Brooklyn Botanic Garden","990 Washington Ave",NA,NA,NA,NA,"Maria Scioli, Human Resources Manager","(781) 250-7039","Catering","69",69,69,"69",69,0,"Separations for 69 employees will occur during the 14-day period commencing January 15, 2023.","----","Contract not renewed","46-5762239","The employees are not represented by a union.","Plant Closing"
"2022-09-30","September 30, 2022","September 2022",NA,"2022-0035","Stuart Goldberg","Plant Closing","HMS Host","John F. Kennedy International Airport, Terminal 8","Queens |Wdb Name: New York City | Region: New York City","Queens","New York City","New York City","Eleni Makris, Field HR Business Partner","(347) 276-1491","Travel Dining Services","155",155,155,"155",155,0,"Separations for 155 employees will occur starting January 1, 2023. All impacted workers have been offered jobs to work with Sodexo before January 1, 2023. The layoffs at HMS Host are expected to be permanent.","1/1/2023","Contract will be transferred to Sodexo on December 1, 2022","----","UNITE H.E.R.E. LOCAL 100","Plant Closing"
"2022-09-29","September 29, 2022","September 2022",NA,"2022-0034","Jason Kirchhoff","Plant Layoff","Intergrow Greenhouses Inc. d/b/a Fillmore Greenhouses","11589 NY-19A","Wyoming |Wdb Name: Glow | Region: Finger Lakes Region","Wyoming","Glow","Finger Lakes Region","Allison Schoolcraft, HR Manager","(585) 682-6319","Food Crops","53",53,53,"----",NA,NA,"Separations for 53 employees will occur on December 31, 2022. The layoffs at Intergrow Greenhouses Inc. are expected to be permanent.","----","Economic- Low production","43-2037073","The employees are not represented by a union.","Plant Layoff"
"2022-09-29","September 29, 2022","September 2022",NA,"2022-0029","Stuart Goldberg","Plant Closing","Sheltering Arms Children Family Services","","Queens, New York, Bronx |Wdb Name: New York City | Region: New York City","Queens, New York, Bronx","New York City","New York City","Elizabeth McCarthy, Chief Executive Officer","(212) 886-5601","Child Day Care Services","105 (total employees at all sites)",105,105,"105",105,0,"The closure of the early childhood programs at multiple locations is expected to be permanent. All employees will be terminated on December 31, 2022.","12/31/2022","Economic","----","DC37 Local 205","Plant Closing Sheltering Arms Children Family Services sites: 500 Bergen Avenue, Bronx, NY 10455 (6 employees affected) 528 East 146th Street, Bronx, NY 10455 (13 employees affected) 669 Lenox Avenue, New York, NY 10037 (23 employees affected) 111-12 Northern Blvd., Queens, NY 11368 (16 employees affected) 565 Morris Avenue, Bronx, NY 10451(32 employees affected) 4439 Third Avenue, Bronx, NY 10457 (15 employees affected)"
"2022-09-30","September 30, 2022","September 2022",NA,"2022-0032","Stuart Goldberg","Plant Closing","Exodus Transitional Community","Multiple New York City locations","Queens, Kings, New York |Wdb Name: New York City | Region: New York City","Queens, Kings, New York","New York City","New York City","Tomasina Salcedo, CBCS, Director of Executive Administration","(917) 492-0990 Ext: 103","Hotels (except Casino Hotels) and Motels","120",120,0,"120",120,0,"Separations for approximately 120 total employees will be affected at multiple locations in New York City beginning October 2022 through December 31, 2022.","12/31/2022","Economic","31-1731465","The employees are not represented by a union.","Plant Closing Exodus Transitional Community sites: The Wolcott, 4 West 31st St., NY, NY 10001 (19 employees affected) Exodus Transitional Community, Inc., 2271 Third Avenue, New York, NY 10035 (19 employees affected) Holiday Inn Express, LGA, 113-10 Horace Harding Expressway, Corona, NY 11368 (17 employees affected Wyndham Gardens, 61-27 186th St., Fresh Meadows, NY 11365 (18 employees affected The Tillary, 85 Flat bush Extension, Brooklyn, NY 1120 (13 employees affected) Howard Johnson, 38-59 12th St., Queens, NY 11101 (15 employees affected) Fairfield Inn & Suites, 29-27 40th Road, Long Island City, NY 11101 (19 employees affected) The Duffield, 60 Duffield Street, Brooklyn, NY 11201 (No employees affected)"
"2022-09-30","September 30, 2022","September 2022",NA,"2022-0030","Staurt Goldberg","Plant Closing","Mermaid 88 LLC d/b/a The Mermaid Inn","570 Amsterdam Ave","New York |Wdb Name: New York City | Region: New York City","New York","New York City","New York City","Susie Chester, Controller, Mermaid Holding Company","(212) 799-2666","Hotel","85",85,85,"85",85,0,"Separations for 85 employees was scheduled to occur on October 16, 2022.","10/16/2022","Sale of Building to new owner","14-2004151","The employees are not represented by a union.","Plant Closing"
"2022-09-30","September 30, 2022","September 2022",NA,"2022-0031","Frederick Danks","Plant Closing","D.V.V.A. Carle Place Restaurant LLC d/b/a Chateau Briand","440 Old Coutry Road","Nassau |Wdb Name: Hempstead | Region: Long Island","Nassau","Hempstead","Long Island","Victor Scotto, General Manager","(516) 334-6125","Restaurant","112",112,112,"112",112,0,"Separations for 112 employees will occur on December 31, 2022 and the restaurant will permanently close thereafter.","12/31/2022","Economic","----","The employees are not represented by a union.","Plant Closing"
"2022-10-01","October 1, 2022","October 2022",NA,"2022-0033","Stuart Goldberg","Plant Layoff","Dylan’s Candy Bar","20 Times Square","New York |Wdb Name: New York City | Region: New York City","New York","New York City","New York City","Evelin Blanco, VP of HR","(212) 620-2701","Retail -Confectionary","58",58,58,"58",58,0,"Effective date of transfer of the 58 affected employees associated with the retail operations conducted at the Time Square location are expected to occur on December 31, 2022. MarketSource has made offers of employment, effective January 1, 2023, to all affected employees.","----","Contract termination- Transfer of contract from Dylan’s Candy Bar to MarketSource","13-4153081","The employees are not represented by a union.","Plant Layoff"
"2022-09-29","September 29, 2022","September 2022",NA,"2022-0028","Amy Riter","Plant Layoff","ImmunityBio, Inc.","3805 Lake Shore Drive East","Chautauqua |Wdb Name: Chautauqua | Region: Western Region","Chautauqua","Chautauqua","Western Region","Emily Arison, Senior Vice President Human Resources","(310) 351-3284","Biotechnology company","38",38,38,"38",38,0,"The facility will be placing 38 employees on inactive status effective 9/29/2022 and terminating employment as of 12/28/2022.","----","Economic","----","The employees are not represented by a union.","Plant Layoff"
"2022-09-29","September 29, 2022","September 2022","Amended: 10/7/2022","2022-0026 and 2022-0027","Jason Kirchhoff and Susan Gallagher","Plant Layoff","Pioneer Credit Recovery, Inc., Gila LLC, Navient B.P.O., LLC,","","Wyoming |Wdb Name: Glow | Region: Finger Lakes Region County: Chemung |Wdb Name: Css | Region: Southern Region","Wyoming","Glow","Finger Lakes Region County: Chemung |WDB Name: CSS | Region: Southern Region","Julia Pfirrman, Senior Director, and Human Resources Business Partner","(513) 605-7400","Provides services to government clients and consumers with expertise in debt recovery","332 (total employees affected at all sites)",332,332,"Arcade = 287 employees; Horseheads = 247 employees; Perry = 389 employees",NA,NA,"Separations for an additional two (2) employees will occur on the 14-day period starting on January 9, 2023.","----","Economic","Navient B.P.O., LLC 85-1187899; Pioneer Credit Recovery, Inc 30-0002602; APG 26- 1814840; Navient Solutions, LLC 54-1843973; Gila LLC 74-2605908","The employees are not represented by a union.","Plant Layoff Pioneer Credit Recovery, Inc., Gila LLC, Navient B.P.O., LLC, Navient Solutions, LLC, or Asset Performance Group, LLC sites: 2022-0026: Finger Lakes Region 26 Edward Street, Arcade , NY 14009 (105 employees affected) 20 Parker Lane, Perry, NY 14530 (123 employees affected) 2022-0027: Southern Region 325 Daniel Zenker Drive, Horseheads, NY 14845 (102 employees affected)"
"2022-09-28","September 28, 2022","September 2022",NA,"2022-0025","Frederick Danks","Plant Closing","Amneal Pharmaceuticals, LLC","75 Adams Avenue","Suffolk |Wdb Name: Suffolk | Region: Long Island","Suffolk","Suffolk","Long Island","Douglas Wallace, VP, Manufacturing - Regional Operations","(631) 219-9501","Pharmaceutical company","13",13,13,"89",89,76,"The business will be permanently closing affecting 13 employees on or about December 31, 2022. The remaining 76 employees are expected to continue to work through March 2023.","The business will be restructuring operations of its Hauppauge facility and will be closing the location in March of 2023.","Economic","26-2478140","The employees are not represented by a union.","Plant Closing"
"2022-09-28","September 28, 2022","September 2022",NA,"2022-0024","Elias Flores","Plant Layoff","GlobalFoundries U.S. 2 LLC","(East Fishkill 300mm Fab)","Dutchess |Wdb Name: Dutchess/Putnam | Region: Mid-Hudson Region","Dutchess","Dutchess/Putnam","Mid-Hudson Region","Colin Mahon, Sr. Director HR Project Management","(845) 235-5136","Semiconductor and Related Device Manufacturing","1,056",1056,1056,"1,056",1056,0,"Separations of the affected employees associated with the manufacturing operations conducted at the East Fishkill Facility are expected to occur on December 31, 2022. ON Semiconductor Corporation has made offers of employment, effective January 1, 2023, to all affected employees.","----","Sale of business to ON Semiconductor Corporation","47-3796721","The employees are not represented by a union.","Plant Layoff"
"2022-09-22","September 22, 2022","September 2022",NA,"2022-0023","Paula Yerdon","Plant Closing","The First Republic Corporation of America DBA Ramada by Wyndham","441 Electronics Parkway","Onondaga |Wdb Name: Onondaga | Region: Central Region","Onondaga","Onondaga","Central Region","James M. Gallagher, Authorized Agent","(315) 898-6081","Hotel","123",123,123,"123",123,0,"The business will be permanently closing on or about December 22, 2022.","12/22/2022","Property being sold","13-1938454","UNITE HERE Local 150","Plant Closing"
"2022-09-18","September 18, 2022","September 2022",NA,"2022-0022","Stuart Goldberg","Plant Closing","Mercer Kitchen LLC dba Mercer Kitchen (Jean-Georges Management)","99 Prince Street","New York |Wdb Name: New York City | Region: New York City","New York","New York City","New York City","Norlenda Villegas, Director of Human Resources","212-358-1365 ext. 103","Restaurant","137",137,137,"137",137,0,"Separations will occur during the 14-day period starting on 12/18/2022.","12/18/2022","Economic","13-3929581","The employees are not represented by a union.","Plant Closing"
"2022-09-19","September 19, 2022","September 2022",NA,"2022-0021","Amy Riter","Plant Layoff","Wells Enterprises, Inc. (Dunkirk Ice Cream Plant)","1 Ice Cream Drive","Chautauqua |Wdb Name: Chautauqua | Region: Western Region","Chautauqua","Chautauqua","Western Region","Patricia Bonnes, Human Resources Business Partner","(716) 317-5423","Ice Cream and frozen desert manufacturer","319",319,0,"643",643,324,"Separation of employees will begin on 12/31/2022, or the 14-day period commencing on that date.","----","Economic","42-1080796","Teamsters Local 264, Affiliate of the International Brotherhood of Teamsters","Plant Layoff"
"2022-09-16","September 16, 2022","September 2022",NA,"2022-0020","Stuart Goldberg","Plant Closing","IKE Logistics LLC","1300 Viele Avenue","Bronx |Wdb Name: New York City | Region: New York City","Bronx","New York City","New York City","Melissa Ochlan, Owner","(646) 423-2781","Cargo transportation company","155",155,155,"155",155,0,"Separations will begin on 12/15/2022.","12/15/2022","Termination of IKE Logistics LLC’s Delivery Services Partner Program Agreement with Amazon Logistics","84-2546113","The employees are not represented by a union.","Plant Closing"
"2022-09-16","September 16, 2022","September 2022",NA,"2022-0019","Amy Riter","Plant Closing","Sanzo Beverage Company, Inc.","3165 Route 16 N.","Cattaraugus |Wdb Name: All/Cat | Region: Western Region","Cattaraugus","All/Cat","Western Region","Christopher Sanzo, CEO/EAM","(716) 372-0330","Beer, Wine & Distilled Alcoholic Beverage Merchant Wholesaler","48",48,48,"48",48,0,"Separations are expected to occur on 11/14/2022.","11/14/2022","Sale of the company’s assets","16-0979390","Teamsters Local 264","Plant Closing"
"2022-09-15","September 15, 2022","September 2022",NA,"2022-0018","Stuart Goldberg","Plant Closing","Wild Ink, Restaurant dba Hudson Yards by Rhubarb LLC","500 W 33rd Street","New York |Wdb Name: New York City | Region: New York City","New York","New York City","New York City","Rajan Lai, Director of Human Resources, USA","(203) 514-8890","Restaurant","89",89,89,"89",89,0,"Separations will occur on or within a 14-day period of 12/17/2022.","12/17/2022","Due to lease agreement being acquired by another owner","38-4049005","The employees are not represented by a union.","Plant Closing"
"2022-08-31","August 31, 2022","August 2022",NA,"2022-0017","Stuart Goldberg","Plant Layoff","Medly Health Inc. (Headquarters & Pharmacy)","31 Debevoise Street","Kings |Wdb Name: New York City | Region: New York City","Kings","New York City","New York City","Nathaniel Dudley, Chief Legal Officer","(781) 856-1974","Pharmacy","110 (Headquarters: 45 affected employees; Pharmacy: 65 affected employees)",110,0,"231",231,121,"8/31/2022","----","Economic","11-3394606","The employees are not represented by a union.","Plant Layoff"
"2022-07-29","July 29, 2022","July 2022","Amendment: 9/1/2022","2022-0007","Frederick Danks","Plant Closing","RoundPoint Mortgage Servicing Corporation","175 Pinelawn Road, Suite 400","Suffolk |Wdb Name: Suffolk | Region: Long Island","Suffolk","Suffolk","Long Island","Zenobia Littlejohn, VP, Human Resources","(856) 380-9628","Non-bank mortgage lending and servicing company","74",74,74,"74",74,0,"The business will be permanently closing affecting 74 employees. Separations will begin on October 27, 2022 or the 14-day period commencing on that date.","10/27/2022","Economic","26-1193089","The employees are not represented by a union.","Plant Closing"
"2022-08-23","August 23, 2022","August 2022",NA,"2022-0016","Paula Yerdon","Plant Closing","Voyant Beauty LLC","","Cortland |Wdb Name: Cayuga/Cort | Region: Central Region","Cortland","Cayuga/Cort","Central Region","Jennifer Coleman, Employee and Community Relations Manager","(607) 218-1971","Supplies plastic bottles for the Voyant product line","320 (total affected at both sites)",320,0,"320",320,0,"Separations will occur in phases with the first phase commencing on or around a 14-day window beginning on 8/26/2022.","12/31/2022","Economic","00-3926223","The employees are not represented by a union.","Plant Closing"
"2022-08-24","August 24, 2022","August 2022",NA,"2022-0015","Stuart Goldberg","Plant Closing","Key Food CS 2 LLC, dba Food Universe","35-09 Francis Lewis Boulevard","Queens |Wdb Name: New York City | Region: New York City","Queens","New York City","New York City","Kathryn Berliner, Human Resource and Retail Operations Manager","(848) 202-7460","Retail food store","54",54,54,"54",54,0,"11/23/2022","11/23/2022","Due to a sale transaction","47-5283159","UFCW Local 338 & Local 342","Plant Closing"
"2022-08-24","August 24, 2022","August 2022",NA,"2022-0014","Paula Yerdon","Plant Layoff","Stafkings of Binghamton Inc. (at 2 Voyant Beauty LLC sites in Cortland)","","Cortland |Wdb Name: Cayuga/Cort | Region: Central Region","Cortland","Cayuga/Cort","Central Region","Tami Rowe, General Manager (Stafkings Personnel Systems)","(315) 234-1029","Staffing vendor of temporary personnel to Voyant Beauty LLC","110 (37 Huntington Street – 42 affected employees); (106 Central Avenue – 68 affected employees)",110,110,"110 (total affected at both sites)",110,0,"Separations will begin on 9/30/2022 for the 3rd shift Central Avenue site and run through 11/23/2022 for both sites. Separation dates may be extended based on business needs.","Voyant Beauty LLC will be permanently closing both sites by the end of the year 2022.","Due to the closing of both Voyant Beauty LLC sites","16-0958156","The employees are not represented by a union.","Plant Layoff"
"2022-08-22","August 22, 2022","August 2022",NA,"2022-0013","Stuart Goldberg","Plant Closing","Packable Holdings, LLC (Pharmapacks, LLC)","One Penn Plaza, Suite 4125","New York |Wdb Name: New York City | Region: New York City","New York","New York City","New York City","Leanna Bautista, Chief People Officer","(929) 201-1753","Multi-marketplace e-commerce enablement platform","25",25,25,"25",25,0,"Separations for 22 employees occurred on 8/22/2022 and remaining separations will occur on 1/8/2023.","1/8/2023","Economic - as a result of the Company’s inability to secure financing to continue the Company’s business.","27-0896676","The employees are not represented by a union.","Plant Closing"
